{
  "$schema": "https://json-schema.org/draft/2020-12/schema",
  "$id": "https://github.com/NicDev-Studios/GameTweaks-Games/schemas/mod.schema.json",
  "title": "GameTweaks mod definition",
  "type": "object",
  "additionalProperties": false,
  "required": ["schemaVersion", "modId", "guid", "version", "official", "name", "description", "integration", "compatibility", "networkAccess", "release", "config"],
  "properties": {
    "schemaVersion": { "const": 1 },
    "modId": { "$ref": "#/$defs/id" },
    "guid": { "type": "string", "minLength": 3, "maxLength": 96, "pattern": "^[A-Za-z0-9_-]+(\\.[A-Za-z0-9_-]+)+$" },
    "version": { "$ref": "#/$defs/semver" },
    "official": { "type": "boolean" },
    "name": { "$ref": "#/$defs/localizedText" },
    "description": { "$ref": "#/$defs/localizedText" },
    "integration": { "enum": ["agent", "configFile"] },
    "compatibility": {
      "type": "object",
      "additionalProperties": false,
      "required": ["runtime", "architectures"],
      "properties": {
        "runtime": { "enum": ["mono", "il2Cpp"] },
        "architectures": { "type": "array", "minItems": 1, "maxItems": 2, "uniqueItems": true, "items": { "enum": ["x86", "x64"] } },
        "minimumAgentVersion": { "$ref": "#/$defs/semver" }
      }
    },
    "networkAccess": { "$ref": "#/$defs/networkAccess" },
    "source": { "$ref": "#/$defs/source" },
    "release": {
      "type": "object",
      "additionalProperties": false,
      "required": ["repository", "tag", "asset", "sha256"],
      "properties": {
        "repository": { "$ref": "#/$defs/repository" },
        "tag": { "$ref": "#/$defs/releasePart" },
        "asset": { "type": "string", "pattern": "^[A-Za-z0-9._+-]+\\.zip$", "maxLength": 180 },
        "sha256": { "$ref": "#/$defs/sha256Lower" }
      }
    },
    "dependencies": { "type": "array", "maxItems": 32, "items": { "$ref": "#/$defs/dependency" } },
    "conflicts": { "type": "array", "maxItems": 32, "uniqueItems": true, "items": { "$ref": "#/$defs/id" } },
    "config": { "type": "array", "maxItems": 512, "items": { "$ref": "#/$defs/configField" } }
  },
  "$defs": {
    "id": { "type": "string", "minLength": 1, "maxLength": 96, "pattern": "^[A-Za-z0-9._-]+$" },
    "semver": {
      "type": "string",
      "maxLength": 64,
      "pattern": "^(0|[1-9][0-9]*)\\.(0|[1-9][0-9]*)\\.(0|[1-9][0-9]*)(?:-(?:0|[1-9][0-9]*|[0-9]*[A-Za-z-][0-9A-Za-z-]*)(?:\\.(?:0|[1-9][0-9]*|[0-9]*[A-Za-z-][0-9A-Za-z-]*))*)?(?:\\+[0-9A-Za-z-]+(?:\\.[0-9A-Za-z-]+)*)?$"
    },
    "sha256": { "type": "string", "pattern": "^[A-Fa-f0-9]{64}$" },
    "sha256Lower": { "type": "string", "pattern": "^[a-f0-9]{64}$" },
    "repository": { "type": "string", "maxLength": 201, "pattern": "^[A-Za-z0-9][A-Za-z0-9_.-]{0,99}/[A-Za-z0-9][A-Za-z0-9_.-]{0,99}$" },
    "networkHost": {
      "type": "string",
      "minLength": 1,
      "maxLength": 253,
      "pattern": "^(?:[a-z0-9](?:[a-z0-9-]{0,61}[a-z0-9])?\\.)+[a-z][a-z0-9-]{1,62}$|^(?:[0-9]{1,3}\\.){3}[0-9]{1,3}$"
    },
    "networkAccess": {
      "oneOf": [
        {
          "type": "object",
          "additionalProperties": false,
          "required": ["usesNetwork", "allowedHosts"],
          "properties": {
            "usesNetwork": { "const": false },
            "allowedHosts": { "type": "array", "maxItems": 0 }
          }
        },
        {
          "type": "object",
          "additionalProperties": false,
          "required": ["usesNetwork", "allowedHosts", "purpose"],
          "properties": {
            "usesNetwork": { "const": true },
            "allowedHosts": {
              "type": "array",
              "minItems": 1,
              "maxItems": 32,
              "uniqueItems": true,
              "items": { "$ref": "#/$defs/networkHost" }
            },
            "purpose": { "$ref": "#/$defs/localizedText" }
          }
        }
      ]
    },
    "source": {
      "type": "object",
      "additionalProperties": false,
      "required": ["repository", "tag", "commit", "workflow"],
      "properties": {
        "repository": { "$ref": "#/$defs/repository" },
        "tag": { "$ref": "#/$defs/releasePart" },
        "commit": { "type": "string", "pattern": "^[a-f0-9]{40}$" },
        "workflow": {
          "type": "string",
          "pattern": "^\\.github/workflows/[A-Za-z0-9._-]+\\.ya?ml$",
          "maxLength": 180
        }
      }
    },
    "releasePart": { "type": "string", "minLength": 1, "maxLength": 180, "pattern": "^[A-Za-z0-9._+-]+$" },
    "localizedText": {
      "type": "object",
      "additionalProperties": false,
      "required": ["en"],
      "properties": { "en": { "type": "string", "minLength": 1, "maxLength": 512 }, "de": { "type": "string", "minLength": 1, "maxLength": 512 } }
    },
    "dependency": {
      "type": "object",
      "additionalProperties": false,
      "required": ["modId", "minimumVersion"],
      "properties": { "modId": { "$ref": "#/$defs/id" }, "minimumVersion": { "$ref": "#/$defs/semver" } }
    },
    "option": {
      "type": "object",
      "additionalProperties": false,
      "required": ["value", "label"],
      "properties": { "value": { "type": "string", "maxLength": 128 }, "label": { "$ref": "#/$defs/localizedText" } }
    },
    "baseField": {
      "type": "object",
      "required": ["id", "section", "key", "label", "applyMode"],
      "properties": {
        "id": { "$ref": "#/$defs/id" },
        "section": { "type": "string", "minLength": 1, "maxLength": 128 },
        "key": { "type": "string", "minLength": 1, "maxLength": 128 },
        "label": { "$ref": "#/$defs/localizedText" },
        "description": { "$ref": "#/$defs/localizedText" },
        "applyMode": { "enum": ["live", "restartRequired", "nextLaunch"] }
      }
    },
    "configField": {
      "allOf": [
        { "$ref": "#/$defs/baseField" },
        {
          "oneOf": [
            { "properties": { "control": { "const": "boolean" }, "default": { "type": "boolean" }, "display": { "enum": ["switch", "checkbox"] } }, "required": ["control", "default"] },
            { "properties": { "control": { "const": "string" }, "default": { "type": "string" }, "maxLength": { "type": "integer", "minimum": 1, "maximum": 65535 } }, "required": ["control", "default", "maxLength"] },
            { "properties": { "control": { "enum": ["integer", "decimal"] }, "default": { "type": "number" }, "min": { "type": "number" }, "max": { "type": "number" }, "step": { "type": "number", "exclusiveMinimum": 0 } }, "required": ["control", "default", "min", "max", "step"] },
            { "properties": { "control": { "const": "singleSelect" }, "default": { "type": "string" }, "options": { "type": "array", "minItems": 1, "items": { "$ref": "#/$defs/option" } }, "display": { "enum": ["dropdown", "radio"] } }, "required": ["control", "default", "options"] },
            { "properties": { "control": { "const": "multiSelect" }, "default": { "type": "array", "items": { "type": "string" } }, "options": { "type": "array", "minItems": 1, "items": { "$ref": "#/$defs/option" } } }, "required": ["control", "default", "options"] }
          ]
        }
      ]
    }
  },
  "allOf": [
    {
      "if": {
        "properties": { "official": { "const": true } },
        "required": ["official"]
      },
      "then": { "required": ["source"] }
    },
    {
      "if": {
        "properties": { "integration": { "const": "agent" } },
        "required": ["integration"]
      },
      "then": {
        "properties": {
          "compatibility": { "required": ["minimumAgentVersion"] }
        }
      },
      "else": {
        "properties": {
          "compatibility": {
            "not": { "required": ["minimumAgentVersion"] }
          }
        }
      }
    }
  ]
}
